{
  "$schema": "https://json-schema.org/draft/2020-12/schema",
  "title": "Skin",
  "type": "object",
  "required": [
    "id",
    "name",
    "description",
    "icon",
    "unlock",
    "hidden",
    "namePlain",
    "descriptionPlain",
    "thumb"
  ],
  "properties": {
    "id": {
      "type": "string",
      "pattern": "^[A-Za-z0-9_-]+$"
    },
    "name": {
      "type": "object",
      "additionalProperties": {
        "type": "string",
        "minLength": 1
      },
      "required": [
        "en"
      ]
    },
    "description": {
      "type": "object",
      "additionalProperties": {
        "type": "string",
        "minLength": 1
      }
    },
    "icon": {
      "type": [
        "string",
        "null"
      ],
      "pattern": "^icons/(items|structures|skins)/[A-Za-z0-9_-]+\\.png$"
    },
    "unlock": {
      "type": [
        "string",
        "null"
      ]
    },
    "hidden": {
      "type": "boolean"
    },
    "namePlain": {
      "type": "object",
      "additionalProperties": {
        "type": "string"
      },
      "description": "name without the game's text markup"
    },
    "descriptionPlain": {
      "type": "object",
      "additionalProperties": {
        "type": "string"
      },
      "description": "description without the game's text markup"
    },
    "thumb": {
      "type": [
        "string",
        "null"
      ],
      "pattern": "^icons/skins/64/[A-Za-z0-9_-]+\\.png$",
      "description": "the icon fitted into 64x64 (null if no icon)"
    },
    "invariant": {
      "type": "boolean",
      "description": "The game marks the form invariant: bosses, cult leaders and other forms it never offers as an unlock"
    },
    "variants": {
      "type": "array",
      "items": {
        "type": "string"
      },
      "description": "Every Spine skin name of the form, as a save's FollowerInfo.SkinName stores it"
    }
  }
}
