{
  "description": {},
  "descriptionPlain": {},
  "hidden": false,
  "icon": "icons/skins/Beluga.png",
  "id": "Beluga",
  "invariant": false,
  "name": {
    "en": "Beluga"
  },
  "namePlain": {
    "en": "Beluga"
  },
  "thumb": "icons/skins/64/Beluga.png",
  "unlock": "Dungeon5",
  "variants": [
    "Beluga",
    "Beluga2",
    "Beluga3"
  ]
}
