{
  "description": {},
  "descriptionPlain": {},
  "hidden": false,
  "icon": "icons/skins/Armadillo.png",
  "id": "Armadillo",
  "invariant": false,
  "name": {
    "en": "Armadillo"
  },
  "namePlain": {
    "en": "Armadillo"
  },
  "thumb": "icons/skins/64/Armadillo.png",
  "unlock": "Dungeon5",
  "variants": [
    "Armadillo",
    "Armadillo2",
    "Armadillo3"
  ]
}
