{
  "description": {},
  "descriptionPlain": {},
  "hidden": false,
  "icon": "icons/skins/Pangolin.png",
  "id": "Pangolin",
  "invariant": false,
  "name": {
    "en": "Pangolin"
  },
  "namePlain": {
    "en": "Pangolin"
  },
  "thumb": "icons/skins/64/Pangolin.png",
  "unlock": "Other",
  "variants": [
    "Pangolin",
    "Pangolin2",
    "Pangolin3"
  ]
}
