{
  "description": {},
  "descriptionPlain": {},
  "hidden": false,
  "icon": "icons/skins/Moose.png",
  "id": "Moose",
  "invariant": false,
  "name": {
    "en": "Moose"
  },
  "namePlain": {
    "en": "Moose"
  },
  "thumb": "icons/skins/64/Moose.png",
  "unlock": "DLC",
  "variants": [
    "Moose",
    "Moose2",
    "Moose3"
  ]
}
