{
  "description": {},
  "descriptionPlain": {},
  "hidden": true,
  "icon": "icons/skins/Bug.png",
  "id": "Bug",
  "invariant": false,
  "name": {
    "en": "Bug"
  },
  "namePlain": {
    "en": "Bug"
  },
  "thumb": "icons/skins/64/Bug.png",
  "unlock": "Dungeon6",
  "variants": [
    "Bug",
    "Bug2",
    "Bug3"
  ]
}
